{
  "task": "TASK-001",
  "status": "refined",
  "actor": "codex",
  "changed_files": [
    ".github/workflows/ci.yml",
    "HANDOFF.json",
    "index.html",
    "package-lock.json",
    "package.json",
    "src/App.test.tsx",
    "src/App.tsx",
    "src/components/Header.tsx",
    "src/components/ItineraryPreview.tsx",
    "src/components/PreferenceForm.tsx",
    "src/main.tsx",
    "src/styles.css",
    "src/test-setup.ts",
    "tsconfig.json",
    "tsconfig.node.json",
    "vite.config.ts",
    "vitest.config.ts"
  ],
  "checks": [
    {
      "name": "artifact JSON and secret scan",
      "result": "pass"
    },
    {
      "name": "npm run typecheck",
      "result": "not_run"
    },
    {
      "name": "npm run test",
      "result": "not_run"
    },
    {
      "name": "npm run build",
      "result": "not_run"
    }
  ],
  "open_points": [
    "GitHub Actions must validate the recovered and Codex-refined candidate."
  ],
  "next_role": "codex"
}
